市区町村,店舗名,住所
渋谷区,恵比寿ファーストスクエア店,東京都 渋谷区 恵比寿1-18-14 恵比寿ファーストスクエア
渋谷区,恵比寿ガーデンプレイス センタープラザB1店,東京都 渋谷区 恵比寿4-20-7 恵比寿ガーデンプレイス センタープラザ B1
渋谷区,恵比寿ユニオンビル店,東京都 渋谷区 恵比寿南1-2-10 エビス ユニオンビル １F
渋谷区,アトレ恵比寿店(2F),東京都 渋谷区 恵比寿南1-5-5 アトレ恵比寿
渋谷区,アトレ恵比寿店(5F),東京都 渋谷区 恵比寿南1-5-5 アトレ恵比寿店　5階
渋谷区,渋谷サクラステージ店,東京都 渋谷区 桜丘町1-4 渋谷サクラステージ SHIBUYAサイド 3階
渋谷区,代官山 蔦屋書店,東京都 渋谷区 猿楽町17-5 蔦屋書店3号館1F
渋谷区,プリンチ 代官山T-SITE,東京都 渋谷区 猿楽町16-15 代官山T-SITE N-4棟1階
渋谷区,渋谷公園通り店,東京都 渋谷区 神南1-7-5 渋谷公園通りＪＮビル 1F
渋谷区,渋谷ファイヤー通り店,東京都 渋谷区 神南1-12-10
渋谷区,渋谷モディ店,東京都 渋谷区 神南1-21-3
渋谷区,SHIBUYA TSUTAYA 2F店,東京都 渋谷区 宇田川町21-6 QFRONT 2F
渋谷区,Olive LOUNGE 渋谷店,東京都 渋谷区 宇田川町20-2 Olive LOUNGE 1階
渋谷区,SHIBUYA TSUTAYA 1F店,東京都 渋谷区 宇田川町21-6 QFRONT 1F
渋谷区,渋谷文化村通り店,東京都 渋谷区 道玄坂2-25-6 ホリウチビル 1F
渋谷区,渋谷マークシティ店,東京都 渋谷区 道玄坂1-12-3 渋谷マークシティ イースト 3F
渋谷区,渋谷フクラス店,東京都 渋谷区 道玄坂1-2-3 渋谷フクラス1階
渋谷区,恵比寿ガーデンプレイスタワー１F店,東京都 渋谷区 恵比寿4-20-3 恵比寿ガーデンプレイスタワー
渋谷区,TSUTAYA BOOKSTORE 渋谷スクランブルスクエア店,東京都 渋谷区 渋谷2-24-12 渋谷スクランブルスクエア
渋谷区,渋谷パルコ店,東京都 渋谷区 宇田川町15-1 渋谷パルコ5階
渋谷区,渋谷ヒカリエ ShinQs店,東京都 渋谷区 渋谷2-21-1 渋谷ヒカリエ ShinQs B1F
渋谷区,北参道店,東京都 渋谷区 千駄ケ谷3-38-9 IBF-PLANNING ビル
渋谷区,リンクスクエア新宿店,東京都 渋谷区 千駄ヶ谷5-27-5 リンクスクエア新宿
渋谷区,新宿サザンテラス店,東京都 渋谷区 代々木2-2-1 新宿サザンテラス内
渋谷区,新宿マインズタワー店,東京都 渋谷区 代々木2-1-1 新宿マインズタワー 1F
渋谷区,新宿南口店,東京都 渋谷区 代々木2-13-8 エスト新宿ビル
渋谷区,代々木店,東京都 渋谷区 代々木1-38-7 川本ビル
渋谷区,アコルデ代々木上原店,東京都 渋谷区 西原3-8-5 アコルデ代々木上原
渋谷区,京王笹塚店,東京都 渋谷区 笹塚1-56-18 京王クラウン街笹塚
中野区,中野通り店,東京都 中野区 中野5-64-5 中野サンピオーネビル 1F
中野区,中野セントラルパーク店,東京都 中野区 中野4-10-2 中野セントラルパークサウス
中野区,中野坂上メトロピア店,東京都 中野区 本町2-48-2 丸の内線中野坂上駅構内
杉並区,Olive LOUNGE 高円寺店,東京都 杉並区 高円寺南4-27-12 Olive LOUNGE 1階
杉並区,ビーンズ阿佐ヶ谷駅前店,東京都 杉並区 阿佐谷南3-58-1 ビーンズ阿佐ヶ谷ぷらす
杉並区,ビーンズ阿佐ヶ谷てくて店,東京都 杉並区 阿佐谷南2-42 ビーンズ阿佐ヶ谷てくて
杉並区,ルミネ荻窪店,東京都 杉並区 上荻1-7-1 ルミネ荻窪店
杉並区,荻窪タウンセブン店,東京都 杉並区 上荻1-9-1 荻窪タウンセブン6F
杉並区,TSUTAYA 浜田山店,東京都 杉並区 浜田山3-37-15
豊島区,大塚駅前店,東京都 豊島区 北大塚2-13-1 ba07
豊島区,アトレヴィ大塚店,東京都 豊島区 南大塚3-33-1 アトレヴィ大塚
豊島区,池袋サンシャイン通り店,東京都 豊島区 東池袋1-20-5 七富久ビル
豊島区,池袋サンシャインシティ アルパ 1階店,東京都 豊島区 東池袋3-1-2 サンシャインシティ アルパ 1階
豊島区,池袋サンシャインシティ アルパ 2階店,東京都 豊島区 東池袋3-1-1 サンシャインシティ アルパ 2階
豊島区,池袋西口店,東京都 豊島区 西池袋1-17-10 エキニア池袋
豊島区,ルミネ池袋2階店,東京都 豊島区 西池袋1-11-1 ルミネ池袋
豊島区,エチカ池袋店,東京都 豊島区 西池袋3-28-14
豊島区,ルミネ池袋9階店,東京都 豊島区 西池袋1-11-1 ルミネ池袋
豊島区,JR池袋駅 西口店,東京都 豊島区 西池袋1-1-25
豊島区,池袋明治通り店,東京都 豊島区 南池袋1-18-17 Ｉ＆Ｋビル 1F
豊島区,南池袋店,東京都 豊島区 南池袋2-16-4 ＳＫビル
豊島区,池袋ショッピングパーク南館店,東京都 豊島区 南池袋1-29-1 池袋ショッピングパーク
豊島区,JR東日本ホテルメッツ 目白店,東京都 豊島区 目白1-4-1 JR東日本ホテルメッツ 目白3階
豊島区,東武池袋店,東京都 豊島区 西池袋1-1-25 東武百貨店　池袋店
豊島区,池袋ショッピングパーク北館店,東京都 豊島区 南池袋1-29-1 池袋ショッピングパーク
北区,王子駅前店,東京都 北区 王子1-9-5 京徳ビル 1F
北区,アトレヴィ田端店,東京都 北区 東田端1-17-2 アトレヴィ田端
北区,イオンスタイル赤羽店,東京都 北区 神谷3-12-1 イオンスタイル赤羽1階
北区,ビーンズ赤羽店,東京都 北区 赤羽1-1-1 ビーンズ赤羽
北区,エキュート赤羽みなみ店,東京都 北区 赤羽1-1-1赤羽駅南改札内 エキュート赤羽みなみ1階
荒川区,Olive LOUNGE 町屋店,東京都 荒川区 町屋1-1-6 Olive LOUNGE 1階
荒川区,LaLaテラス南千住店,東京都 荒川区 南千住4-7-2 LaLaテラス南千住 B棟1階
板橋区,日本大学板橋病院店,東京都 板橋区 大谷口上町30-1 日本大学医学部附属板橋病院
板橋区,帝京大学板橋キャンパス店,東京都 板橋区 加賀2-11-1 帝京大学板橋キャンパス
板橋区,板橋蓮根店,東京都 板橋区 蓮根2-9-12
板橋区,イオン板橋店,東京都 板橋区 徳丸2-6-1 イオン板橋
板橋区,エキア成増店,東京都 板橋区 成増2-13-1 EQUiA成増 2階
板橋区,Olive LOUNGE 成増店,東京都 板橋区 成増2-16-1 Olive LOUNGE 1階
練馬区,エミオ練馬店,東京都 練馬区 練馬1-3-5 エミオ練馬
練馬区,エミオ石神井公園店,東京都 練馬区 石神井町3-23-5 エミオ石神井公園 1階
練馬区,大泉学園ゆめりあフェンテ店,東京都 練馬区 東大泉5-43-1 ゆめりあフェンテ
練馬区,光が丘IMA店,東京都 練馬区 光が丘5-1-1 光が丘IMA
練馬区,練馬光が丘病院店,東京都 練馬区 光が丘2-5-1
足立区,ららテラス北綾瀬店,東京都 足立区 谷中4-8-1 ららテラス北綾瀬2階
足立区,エキア北千住店,東京都 足立区 千住旭町42-1 EQUiA北千住
足立区,ルミネ北千住店,東京都 足立区 千住旭町42-2 ルミネ北千住
足立区,北千住マルイ店,東京都 足立区 千住3-92 北千住マルイ
足立区,エキア竹ノ塚店,東京都 足立区 西竹の塚2-1-2 EQUiA竹ノ塚1階
足立区,アリオ西新井店,東京都 足立区 西新井栄町1-20-1 アリオ西新井
葛飾区,シャポー新小岩店,東京都 葛飾区 新小岩1-45-1 シャポー新小岩1階
葛飾区,金町駅南口店,東京都 葛飾区 金町6-4-2 ラヴィクレール金町
葛飾区,アリオ亀有店,東京都 葛飾区 亀有3-49-3 アリオ亀有
葛飾区,ビーンズ亀有店,東京都 葛飾区 亀有3-25-1 ビーンズ亀有 1階
葛飾区,東京理科大学葛飾キャンパス店,東京都 葛飾区 新宿6-3-1 東京理科大学葛飾キャンパス内共創棟
江戸川区,シャポー小岩店,東京都 江戸川区 南小岩7-24-15
江戸川区,葛西駅南口店,東京都 江戸川区 東葛西6-2-1 RECS東葛西2階
江戸川区,江戸川総合レクリエーション公園店,東京都 江戸川区 南葛西3-23-9 江戸川総合レクリエーション公園 ファミリースポーツ広場
江戸川区,葛西臨海公園駅店,東京都 江戸川区 臨海町6-3-4 葛西臨海公園駅高架下ビル