市区町村,店舗名,住所
千代田区,皇居外苑 和田倉噴水公園店,東京都 千代田区 皇居外苑3-1
千代田区,竹橋パレスサイド店,東京都 千代田区 一ツ橋1-1-1 竹橋パレスサイドビルディング 1F
千代田区,ＫＤＤＩ大手町ビル店,東京都 千代田区 大手町1-8-1 ＫＤＤＩ大手町ビル 1F
千代田区,大手町東京サンケイビル店,東京都 千代田区 大手町1-7-2 東京サンケイビル　B1階
千代田区,大手町ビル店,東京都 千代田区 大手町1-6-1 大手町ビル
千代田区,大手町プレイス店,東京都 千代田区 大手町2-3-1 大手町プレイス
千代田区,丸の内三菱ビル店,東京都 千代田区 丸の内2-5-2 三菱ビル
千代田区,丸の内新東京ビル店,東京都 千代田区 丸の内3-3-1 丸の内新東京ビル
千代田区,ＪＲ東京駅日本橋口店,東京都 千代田区 丸の内1-9-1 丸の内中央ビル
千代田区,東京ステーションシティ サピアタワー店,東京都 千代田区 丸の内1-7-12
千代田区,グランスタ丸の内店,東京都 千代田区 丸の内1-9-1 JR東日本東京駅構内地下1階改札外
千代田区,グランスタ八重洲店,東京都 千代田区 丸の内1-9-1 東京駅八重洲中央口B1F　グランスタ八重洲
千代田区,丸の内オアゾ店,東京都 千代田区 丸の内1-6-4 丸の内OAZO
千代田区,グランスタ東京店,東京都 千代田区 丸の内1-9-1 JR東日本東京駅構内１F グランスタ東京 京葉ストリートエリア
千代田区,東京駅八重洲北口 東京ギフトパレット店,東京都 千代田区 丸の内1-9-1 東京駅
千代田区,東京ミッドタウン日比谷店,東京都 千代田区 有楽町1-1-4 東京ミッドタウン日比谷
千代田区,有楽町メトロピア店,東京都 千代田区 有楽町1-11-1 東京メトロ有楽町駅構内
千代田区,JR有楽町駅京橋口店,東京都 千代田区 有楽町2-9
千代田区,日比谷シティ店,東京都 千代田区 内幸町2-2-3 日比谷国際ビルヂング B1F(B132)
千代田区,山王パークタワー店,東京都 千代田区 永田町2-11-1 山王パークタワー
千代田区,赤坂プルデンシャルタワー店,東京都 千代田区 永田町2-13-10 プルデンシャルタワー
千代田区,霞ダイニング店,東京都 千代田区 霞が関3-2-5 霞が関ビルディング
千代田区,丸の内ビル店,東京都 千代田区 丸の内2-4-1 丸の内ビルディング
千代田区,TSUTAYA BOOKSTORE MARUNOUCHI店 ,東京都 千代田区 丸の内2-4-1 丸の内ビルディング
千代田区,新丸ビル店,東京都 千代田区 丸の内1-5-1 新丸の内ビル
千代田区,大手町カンファレンスセンター店,東京都 千代田区 大手町1-3-1 JAビル
千代田区,丸の内パークビル店,東京都 千代田区 丸の内2-6-1 丸の内パークビルディング
千代田区,ＫＩＴＴＥ丸の内店,東京都 千代田区 丸の内2-7-2
千代田区,アトレ秋葉原1店,東京都 千代田区 外神田1-17-6 アトレ秋葉原１
千代田区,JR東日本ホテルメッツ プレミア 秋葉原店,東京都 千代田区 外神田1-17-4 JR東日本ホテルメッツ プレミア 秋葉原
千代田区,秋葉原駅前店,東京都 千代田区 神田佐久間町1-6-5 AKIBA・TOLIM
千代田区,神田駅南口店,東京都 千代田区 鍛冶町2-13-1 JR神田駅南改札口外
千代田区,神田駅前店,東京都 千代田区 神田鍛冶町3-2 神田サンミビル
千代田区,都営神保町駅店,東京都 千代田区 神田神保町2-7 都営三田線・新宿線「神保町駅」構内
千代田区,神田小川町２丁目店,東京都 千代田区 神田小川町2-5-5 紀陽東京ビル 1F
千代田区,お茶の水村田ビル店,東京都 千代田区 神田駿河台2-5 村田ビルディング 1F
千代田区,お茶の水サンクレール店,東京都 千代田区 神田駿河台4-3
千代田区,御茶ノ水ソラシティ店,東京都 千代田区 神田駿河台4-6 御茶ノ水ソラシティ
千代田区,淡路町駅前店,東京都 千代田区 神田淡路町1-2
千代田区,飯田橋サクラテラス店,東京都 千代田区 富士見2-10-2
千代田区,飯田橋サクラテラス 2階店,東京都 千代田区 富士見2-10-2 飯田橋グラン・ブルーム　サクラテラス
千代田区,飯田橋アイガーデンテラス店,東京都 千代田区 飯田橋3-10-9 アイガーデンテラス
千代田区,九段下店,東京都 千代田区 九段北1-2-1 九段北1丁目ビル 1F
千代田区,北の丸スクエア店,東京都 千代田区 九段北1-13-12 北の丸スクエア
千代田区,市ヶ谷駅前店,東京都 千代田区 五番町2 市ヶ谷ストア 2F
千代田区,麹町店,東京都 千代田区 麹町3-2-5 垣見麹町ビル別館 1F
千代田区,上智大学 四谷キャンパス店,東京都 千代田区 麹町6-1-18 上智大学15号館1階
千代田区,東京ガーデンテラス紀尾井町店,東京都 千代田区 紀尾井町1-2 東京ガーデンテラス紀尾井町
中央区,人形町店,東京都 中央区 日本橋人形町3-6-7 人形町共同ビル 1F
中央区,日本橋スルガビル店,東京都 中央区 日本橋室町1-7-1 スルガビル 1F
中央区,コレド室町テラス店,東京都 中央区 日本橋室町3-2-1 コレド室町テラス 地下1階
中央区,コレド室町2店,東京都 中央区 日本橋室町2-3-1 コレド室町2 地下1階
中央区,日本橋本町店,東京都 中央区 日本橋本町2-4-5 扶桑日本橋ビル 1F
中央区,茅場町店,東京都 中央区 日本橋茅場町1-12-2 樋口本店ビル 1F
中央区,ＪＲ東海 東京駅新幹線南ラチ内店,東京都 中央区 八重洲1-7-20 八重洲口会館　JR-PLUS関東支社
中央区,日本橋高島屋Ｓ.Ｃ.5階店,東京都 中央区 日本橋2-5-1 日本橋高島屋Ｓ.Ｃ. 新館5階
中央区,日本橋高島屋Ｓ.Ｃ.1階店,東京都 中央区 日本橋2-5-1 日本橋高島屋Ｓ.Ｃ. 新館1階
中央区,ヤエチカ店,東京都 中央区 八重洲2-1 八重洲地下街 中3号
中央区,東京ミッドタウン八重洲店,東京都 中央区 八重洲2-2-1 東京ミッドタウン八重洲
中央区,京橋エドグラン店,東京都 中央区 京橋2-2-1 京橋エドグラン
中央区,築地駅前店,東京都 中央区 築地2-12-8 大広ビル 1F
中央区,晴海 トリトンスクエア店 ,東京都 中央区 晴海1-8-10 晴海アイランド トリトンスクエア オフィスタワーX
中央区,勝どき店,東京都 中央区 勝どき4-6-2 パークタワー勝どきミッド1階
中央区,銀座松屋通り店,東京都 中央区 銀座3-7-14 ＥＳＫビル 1F
中央区,スターバックス リザーブ(R)ストア 銀座マロニエ通り ,東京都 中央区 銀座3-7-3 銀座オーミビル 1F
中央区,東銀座店,東京都 中央区 銀座5-15-8 時事通信ビル
中央区,銀座ファイブ店,東京都 中央区 銀座5丁目1番先 GINZA FIVE
中央区,GINZA SIX店,東京都 中央区 銀座6-10-1
中央区,マロニエゲート銀座1店,東京都 中央区 銀座2-2-14 マロニエゲート銀座1
中央区,銀座EXITMELSA店,東京都 中央区 銀座5-7-10
中央区,銀座 蔦屋書店,東京都 中央区 銀座6-10-1 GINZA SIX 6階
中央区,エチカフィット銀座店,東京都 中央区 銀座4-1-2 東京メトロ銀座駅構内
中央区,CIRCLES 銀座店,東京都 中央区 銀座3-7-6 CIRCLES 銀座
中央区,スターバックス ティバーナストア 銀座マロニエ通り,東京都 中央区 銀座3-7-3 銀座オーミビル B1F
中央区,聖路加国際病院店,東京都 中央区 明石町9-1 聖路加国際病院
港区,虎ノ門駅前店,東京都 港区 虎ノ門1-1-23 ウンピン虎ノ門ビル 1F
港区,虎ノ門アルセアタワー店,東京都 港区 虎ノ門2-2-3 虎ノ門アルセアタワー 1階
港区,新橋駅前店,東京都 港区 新橋2-19-3 カシケイビル 1F
港区,JR新橋駅 銀座口店,東京都 港区 新橋2-17-14 新橋駅1階
港区,芝大門店,東京都 港区 芝公園2-3-4 リッチモンドホテル東京芝
港区,ブルーフロント芝浦店,東京都 港区 芝浦1-1-1 BLUE FRONT SHIBAURA3階
港区,虎ノ門ヒルズ ステーションタワー店,東京都 港区 虎ノ門2-6-3 虎ノ門ヒルズステーションタワー7階
港区,愛宕グリーンヒルズ店,東京都 港区 愛宕2-5-1 ＭＯＲＩ タワー（愛宕グリーンヒルズ）
港区,虎ノ門ヒルズ ビジネスタワー店,東京都 港区 虎ノ門1-17-1 虎ノ門ヒルズ ビジネスタワー
港区,東京ワールドゲート神谷町店,東京都 港区 虎ノ門4-1-1 神谷町トラストタワー
港区,カレッタ汐留店,東京都 港区 東新橋1-8-2 カレッタ汐留
港区,汐留シティセンター店,東京都 港区 東新橋1-5-2 汐留シティセンター
港区,東京汐留ビルディング店,東京都 港区 東新橋1-9-1 東京汐留ビルディング地下2階
港区,日テレプラザ店,東京都 港区 東新橋1-6-1 日本テレビタワー 2階
港区,六本木７丁目店,東京都 港区 六本木7-14-1 東李閣ビル 1F
港区,六本木ヒルズ メトロハット／ハリウッドプラザ店,東京都 港区 六本木6-4-1 メトロハット/ハリウッドプラザ
港区,六本木ヒルズ ウエストウォーク店,東京都 港区 六本木6-10-1 森タワー 2F
港区,アークヒルズサウスタワー店,東京都 港区 六本木1-4-5 アークヒルズサウスタワー
港区,六本木 蔦屋書店,東京都 港区 六本木6-11-1 ゲートタワー
港区,麻布台ヒルズ店,東京都 港区 麻布台1-3-1 麻布台ヒルズ タワープラザ 地下1階
港区,麻布十番店,東京都 港区 麻布十番1-11-14 ＳＢＳビル
港区,麻布十番２丁目店,東京都 港区 麻布十番2-3-12
港区,六本木ヒルズ ウエストウォーク ラウンジ店,東京都 港区 六本木6-10-1 森タワー 1F
港区,赤坂見附店,東京都 港区 赤坂3-21-20 赤坂ロングビーチビル 1F
港区,赤坂溜池タワー店,東京都 港区 赤坂2-17-1 赤坂溜池タワー
港区,赤坂インターシティAIR店,東京都 港区 赤坂1-8-1
港区,東京ミッドタウン店,東京都 港区 赤坂9-7-2 東京ミッドタウンB0103
港区,アクセス表参道店,東京都 港区 北青山3-6-17 アクセス表参道ビル
港区,青山ビルヂング店,東京都 港区 北青山1-2-3 青山ビル
港区,南青山２丁目店,東京都 港区 南青山2-26-37 VORT外苑前Ⅰ1F
港区,青山骨董通り店,東京都 港区 南青山5-10-1 H2 AOYAMA BUILDING
港区,南青山骨董通り店,東京都 港区 南青山5-4-27 Barbizon104
港区,アークヒルズ店,東京都 港区 赤坂1-12-32 アーク森ビル 1F
港区,赤坂Bizタワー店,東京都 港区 赤坂5-3-1 赤坂Bizタワー(区画番号206)
港区,新田町ビル店,東京都 港区 芝5-34-6 新田町ビル
港区,田町タワー店,東京都 港区 芝5-33-11 田町タワーモール1階
港区,ムスブ田町2階店,東京都 港区 芝浦3-1-21 msb Tamachi 田町ステーションタワーS 2階205
港区,ムスブ田町4階店,東京都 港区 芝浦3-1-21 msb Tamachi 田町ステーションタワーS 4階402
港区,白金高輪店,東京都 港区 白金1-17-2-102 白金アエルシティ
港区,ニュウマン高輪店,東京都 港区 高輪2-21-1 ニュウマン高輪 North 5階
港区,品川インターシティ店,東京都 港区 港南2-15-2 品川インターシティ 2F (206)
港区,高輪ゲートウェイ駅店,東京都 港区 港南2-1-220 JR高輪ゲートウェイ駅改札外3階
港区,ＪＲ東海 品川駅ラチ内店,東京都 港区 港南2-1-78 JR-PLUS品川事務所
港区,JR東海 品川駅店,東京都 港区 港南2-1-78 JR-PLUS品川事務所
港区,アクアシティお台場店,東京都 港区 台場1-7-1（区番R306） アクアシティお台場
新宿区,四谷３丁目店,東京都 新宿区 四谷2-14-4 ミツヤ四谷ビル 1F
新宿区,アトレ四谷店,東京都 新宿区 四谷1-5-25 アトレ四谷
新宿区,都立明治公園店,東京都 新宿区 霞ヶ丘町5-7 都立明治公園 B棟
新宿区,新宿御苑店,東京都 新宿区 内藤町11 新宿御苑
新宿区,アトレ信濃町店,東京都 新宿区 信濃町34 アトレ信濃町
新宿区,西武新宿ＰｅＰｅ店,東京都 新宿区 歌舞伎町1-30-1 西武新宿ペペ
新宿区,新宿サブナード店,東京都 新宿区 歌舞伎町1丁目サブナード1 新宿サブナード
新宿区,東急歌舞伎町タワー店,東京都 新宿区 歌舞伎町1-29-1 東急歌舞伎町タワー
新宿区,新宿３丁目店,東京都 新宿区 新宿3-11-6 エクレ新宿 1F
新宿区,新宿ダイアンビル店,東京都 新宿区 新宿3-36-6 大安ビル 1F
新宿区,新宿新南口店,東京都 新宿区 新宿4-1-9 新宿ユースビル 1F
新宿区,ルミネエスト新宿店,東京都 新宿区 新宿3-38-1 ルミネエスト ２Ｆ
新宿区,スターバックス リザーブ(R) カフェ 新宿マルイ本館2階店,東京都 新宿区 新宿3-30-13 新宿マルイ本館
新宿区,新宿マルイ本館8階店,東京都 新宿区 新宿3-30-13 新宿マルイ本館
新宿区,新宿2丁目店,東京都 新宿区 新宿2-5-12 FORECAST新宿AVENUE
新宿区,京王新宿三丁目ビル店,東京都 新宿区 新宿3-1-24 京王新宿三丁目ビル
新宿区,西新宿三井ビル店,東京都 新宿区 西新宿6-24-1 西新宿三井ビル
新宿区,新宿グリーンタワービル店,東京都 新宿区 西新宿6-14-1 新宿グリーンタワー
新宿区,新宿西口店,東京都 新宿区 西新宿1-12-1 高倉第一ビル
新宿区,ルミネ新宿店,東京都 新宿区 西新宿1-1-5 ルミネ新宿１
新宿区,新宿中央公園 SHUKNOVA店,東京都 新宿区 西新宿2-11-5
新宿区,小田急百貨店SHINJUKU DELISH PARK店,東京都 新宿区 西新宿1丁目西口地下街１号 小田急エース北館
新宿区,慶應義塾大学病院店,東京都 新宿区 信濃町35
新宿区,飯田橋軽子坂店,東京都 新宿区 揚場町2-1 軽子坂ＭＮビル 1F
新宿区,飯田橋メトロピア店,東京都 新宿区 神楽坂1-13 南北線飯田橋駅構内
新宿区,神楽坂下店,東京都 新宿区 神楽坂1-9-2 秀永ビル
新宿区,早稲田大学戸山キャンパス店,東京都 新宿区 戸山1-24-1 早稲田アリーナ
新宿区,新宿三井ビル店,東京都 新宿区 西新宿2-1-1 新宿三井ビルディング
新宿区,新宿野村ビル店,東京都 新宿区 西新宿1-26-2 新宿野村ビル B1F
新宿区,新宿エルタワー店,東京都 新宿区 西新宿1-6-1 新宿エルタワー
新宿区,新大久保駅店,東京都 新宿区 百人町1-10-15
新宿区,西武高田馬場駅店,東京都 新宿区 高田馬場1-35-2 高田馬場西武ラチ内コンコース
文京区,東京ドームシティ ラクーア店,東京都 文京区 春日1-1-1 ラクーア
文京区,水道橋後楽森ビル店,東京都 文京区 後楽1-4-14 後楽森ビル 1F
文京区,茗荷谷店,東京都 文京区 大塚1-4-1 中央大学 茗荷谷キャンパス
文京区,東京ドームシティ ミーツポート店,東京都 文京区 後楽1-3-61 東京ドームシティミーツポート1階
文京区,本郷東大前店,東京都 文京区 本郷4-1-4 Design Placeα 1F
文京区,順天堂医院店,東京都 文京区 本郷3-1-3 順天堂大学医学部附属順天堂医院 (1号館）
文京区,東京科学大学店,東京都 文京区 湯島1-5-45 東京科学大学C棟1階
文京区,日本医科大学付属病院店,東京都 文京区 千駄木1-1-5 日本医科大学付属病院
文京区,東京大学工学部店,東京都 文京区 本郷7-3-1 工学部11号館
台東区,上野マルイ店,東京都 台東区 上野6-15-1 上野マルイ店 B1F
台東区,御徒町春日通り店,東京都 台東区 上野6-2-1 ヨシダビル
台東区,アトレ上野店,東京都 台東区 上野7-1-1 アトレ上野 1F
台東区,パルコヤ上野店,東京都 台東区 上野3-24-6 パルコヤ 5階
台東区,エキュート上野 公園口店,東京都 台東区 上野7-1-1 エキュート上野
台東区,JR上野駅 入谷改札前店,東京都 台東区 上野7-1-1 上野駅構内3階入谷口改札外
台東区,上野恩賜公園店,東京都 台東区 上野公園8-22
台東区,雷門店,東京都 台東区 浅草1-18-2 雷門旅館
台東区,浅草駅前店,東京都 台東区 花川戸1-5-1
台東区,浅草雷門通り店,東京都 台東区 雷門2-16-7 グランコピエ浅草雷門
墨田区,錦糸町オリナス店,東京都 墨田区 太平4-1-2 オリナス
墨田区,錦糸町テルミナ2店,東京都 墨田区 錦糸1-2-47 テルミナ2
墨田区,錦糸町 丸井店,東京都 墨田区 江東橋3-9-10 丸井 錦糸町店
墨田区,錦糸町パルコ店,東京都 墨田区 江東橋4-27-14 楽天地ビル
墨田区,錦糸町メトロピア店,東京都 墨田区 江東橋3-14-6 東京メトロ錦糸町駅構内 錦糸町メトロピア
墨田区,東京スカイツリータウン・ソラマチ東6階店,東京都 墨田区 押上1-1-2 東京スカイツリータウン
墨田区,東京スカイツリータウン・ソラマチ西1階店,東京都 墨田区 押上1-1-2 東京スカイツリータウン
江東区,木場イトーヨーカドー店,東京都 江東区 木場1-5-30 イトーヨーカドー木場店 1F
江東区,豊洲フォレシア店,東京都 江東区 豊洲3-2-24 豊洲フォレシア
江東区,アーバンドック ららぽーと豊洲3 地下1階店,東京都 江東区 豊洲2-2-1 ららぽーと豊洲3 地下1階
江東区,TSUTAYA BOOKSTORE 東雲店,東京都 江東区 東雲2-7-20
江東区,東京ビッグサイト店,東京都 江東区 有明3-11-1 東京ビッグサイト　レストラン街
江東区,ダイバーシティ東京 プラザ店,東京都 江東区 青海1-1-10 ダイバーシティ東京 プラザ 2階
江東区,豊洲センタービル店,東京都 江東区 豊洲3-3-3 豊洲センタービル 1F
江東区,ららぽーと豊洲 サウスポート2階店,東京都 江東区 豊洲2-4-9 ららぽーと豊洲
江東区,ららぽーと豊洲 シーサイドデッキ店,東京都 江東区 豊洲2-4-9 アーバンドック　ららぽーと豊洲
江東区,アトレ亀戸店,東京都 江東区 亀戸5-1-1 アトレ亀戸 1F
江東区,カメイドクロック店,東京都 江東区 亀戸6-31-6 KAMEIDO CLOCK
江東区,アリオ北砂店,東京都 江東区 北砂2-17-1 アリオ北砂
江東区,南砂町 SUNAMO店,東京都 江東区 新砂3-4-31 南砂町ショッピングセンター SUNAMO１階
江東区,イオン南砂店,東京都 江東区 南砂6-7-15 イオン南砂店 1F
品川区,天王洲店,東京都 品川区 東品川2-2-4 天王洲ファーストタワー
品川区,イオンスタイル品川シーサイド店,東京都 品川区 東品川4-12-5 イオンスタイル品川シーサイド
品川区,大井町駅東口店,東京都 品川区 東大井5-20-1
品川区,エトモ大井町店,東京都 品川区 大井1-1-1 エトモ大井町
品川区,阪急大井町ガーデン店,東京都 品川区 大井1-50-5 新阪急大井町ビル
品川区,大崎ブライトタワー店,東京都 品川区 北品川5-6-1 大崎ブライトタワー
品川区,目黒店,東京都 品川区 上大崎2-25-2 新目黒東急ビル
品川区,目黒セントラルスクエア店,東京都 品川区 上大崎3-1-1
品川区,アトレ目黒1店,東京都 品川区 上大崎2-16-9 アトレ目黒1 1F
品川区,五反田東急スクエア店,東京都 品川区 東五反田2-1-2 五反田東急スクエア
品川区,西五反田店,東京都 品川区 西五反田1-18-1 ゴタンダ エクス 1F
品川区,ゲートシティ大崎店,東京都 品川区 大崎1-11-1 ゲートシティ大崎
品川区,武蔵小山店,東京都 品川区 小山3-15-1 パークシティ武蔵小山ザ モール
目黒区,イオンスタイル碑文谷店,東京都 目黒区 碑文谷4-1-1
目黒区,学芸大駅前店,東京都 目黒区 鷹番3-15-25 鳥芳ビル 1F
目黒区,Olive LOUNGE 都立大学駅前店,東京都 目黒区 中根1-3-1 Olive LOUNGE 1階
目黒区,自由が丘店,東京都 目黒区 自由が丘2-10-18 栗山ビルⅡ 1F
目黒区,自由が丘駅前店,東京都 目黒区 自由が丘1-11-6 YG自由が丘ビル 1F
目黒区,STARBUCKS RESERVE(R) ROASTERY TOKYO,東京都 目黒区 青葉台2-19-23
目黒区,中目黒山手通り店,東京都 目黒区 上目黒3-1-3 プライムアーバン中目黒Ⅱ
目黒区,中目黒GTタワー店,東京都 目黒区 上目黒2-1-1 中目黒ゲートタウンタワー B1F
目黒区,中目黒 蔦屋書店,東京都 目黒区 上目黒1-22-10
目黒区,エトモ祐天寺店,東京都 目黒区 祐天寺2-13-4 エトモ祐天寺
大田区,アトレ大森店(2F),東京都 大田区 大森北1-6-16 アトレ大森 2F
大田区,アトレ大森店(5F),東京都 大田区 大森北1-6-16 アトレ大森 5F
大田区,羽田空港第1ターミナル マーケットプレイス3階店,東京都 大田区 羽田空港3-3-2 第一旅客ターミナル3階
大田区,羽田空港第1ターミナル THE HANEDA HOUSE5階店,東京都 大田区 羽田空港3-3-2 第一旅客ターミナル5階
大田区,羽田空港第2ターミナル国内線ゲートエリア店,東京都 大田区 羽田空港3-4-2 東京国際空港第2旅客ターミナルビル
大田区,羽田空港第2ターミナル国際線ゲートエリア店,東京都 大田区 羽田空港3-4-2 第2旅客ターミナルビル
大田区,羽田空港 蔦屋書店,東京都 大田区 羽田空港3-4-2 第2旅客ターミナルビル
大田区,グランデュオ蒲田店,東京都 大田区 西蒲田7-68-1 グランデュオ蒲田　西館
大田区,田園調布 東急スクエアガーデンサイト店,東京都 大田区 田園調布2-62-3 東急スクエアガーデンサイト　アネックス
大田区,エトモ池上店,東京都 大田区 池上6-3-10 エトモ池上
世田谷区,池尻2丁目店,東京都 世田谷区 池尻2-27-7 アリビエ池尻
世田谷区,三軒茶屋店,東京都 世田谷区 太子堂4-20-25 三軒茶屋アバックビル
世田谷区,駒沢パーククォーター店,東京都 世田谷区 上馬3-18-7 KOMAZAWA Park Quarter1階
世田谷区,駒沢1丁目店,東京都 世田谷区 駒沢1-24-5
世田谷区,桜新町店,東京都 世田谷区 桜新町2-10-4
世田谷区,梅ヶ丘駅店,東京都 世田谷区 梅丘1-31-21
世田谷区,下北沢店,東京都 世田谷区 北沢2-30-6 下北沢ＵＣビル 1F
世田谷区,シモキタエキウエ店,東京都 世田谷区 北沢2-24-2 小田急下北沢駅 シモキタエキウエ内
世田谷区,代沢5丁目店,東京都 世田谷区 代沢5-8-13 クリークス代沢
世田谷区,明大前店,東京都 世田谷区 松原2-46-5 Ｒｙｕ’ｓビル 1F
世田谷区,Olive LOUNGE 下高井戸店,東京都 世田谷区 赤堤4-47-10 Olive LOUNGE 1階
世田谷区,経堂駅店,東京都 世田谷区 経堂2-1-3
世田谷区,千歳船橋駅店,東京都 世田谷区 船橋1-9-45 小田急マルシェ千歳船橋2
世田谷区,芦花公園店,東京都 世田谷区 南烏山1-2-17
世田谷区,千歳烏山店,東京都 世田谷区 南烏山5-15-10 SKCビル
世田谷区,成城店,東京都 世田谷区 成城2-40-25 パレブラン成城
世田谷区,奥沢2丁目店,東京都 世田谷区 奥沢2-38-9
世田谷区,二子玉川ライズ ドッグウッドプラザ店,東京都 世田谷区 玉川2-23-1 二子玉川ライズショッピングセンター　ドッグウッドプラザ
世田谷区,二子玉川公園店,東京都 世田谷区 玉川1-16-1
世田谷区,二子玉川 蔦屋家電店,東京都 世田谷区 玉川1-14-1 二子玉川ライズ　S.C.　テラスマーケット
世田谷区,用賀店,東京都 世田谷区 瀬田5-39-22
世田谷区,世田谷ビジネススクエア店,東京都 世田谷区 用賀4-10-1
世田谷区,玉川高島屋Ｓ・Ｃ店,東京都 世田谷区 玉川3-17-1 玉川高島屋Ｓ・Ｃ (南館７階)
渋谷区,明治神宮前メトロピア店,東京都 渋谷区 神宮前1-18-22駅事務室 千代田線　明治神宮前駅
渋谷区,神宮前6丁目店,東京都 渋谷区 神宮前6-17-11 JPR原宿ビル
渋谷区,表参道 神宮前4丁目店,東京都 渋谷区 神宮前4-3-4 Ｂａｒｂｉｚｏｎ ７ ＡＮＮＥＸ
渋谷区,東急プラザ表参道オモカド店,東京都 渋谷区 神宮前4-30-3 東急プラザ表参道「オモカド」
渋谷区,表参道ヒルズ店,東京都 渋谷区 神宮前4-12-10 表参道ヒルズ
渋谷区,WITH HARAJUKU店,東京都 渋谷区 神宮前1-14-30 WITH HARAJUKU
渋谷区,MIYASHITA PARK店,東京都 渋谷区 神宮前6-20-10 MIYASHITA PARK North 4階 (区画番号40000)
渋谷区,渋谷３丁目店,東京都 渋谷区 渋谷3-11-7 第２ミネギシビル
渋谷区,渋谷クロスタワー店,東京都 渋谷区 渋谷2-15-1 渋谷クロスタワー 3F
渋谷区,渋谷2丁目店,東京都 渋谷区 渋谷2-9-8 日総第25ビル
渋谷区,渋谷ストリーム店,東京都 渋谷区 渋谷3-21-3 渋谷ストリーム
渋谷区,渋谷cocoti店,東京都 渋谷区 渋谷1-23-16 cocoti SHIBUYA
渋谷区,広尾店,東京都 渋谷区 広尾5-14-5 ノースゲートビル
